{
 "match_id": 3869354,
 "competition": "FIFA World Cup",
 "season": "2022",
 "stage": "Quarter-finals",
 "date": "2022-12-10",
 "teams": {
  "home": {
   "id": 768,
   "name": "England",
   "color": "#2E75B6"
  },
  "away": {
   "id": 771,
   "name": "France",
   "color": "#B75410"
  }
 },
 "score": {
  "home": 1,
  "away": 2,
  "shootout": null,
  "note": null
 },
 "possession": {
  "method": "sum of possession-sequence duration (penalty shootout excluded)",
  "home": 0.6017,
  "away": 0.3983
 },
 "stats": {
  "home": {
   "shots": 16,
   "on_target": 7,
   "passes": 554,
   "passes_completed": 465,
   "pass_accuracy": 0.8394,
   "xg_model": 2.507,
   "xg_statsbomb": 2.353,
   "fouls": 10,
   "corners": 5,
   "yellow": 1,
   "red": 0
  },
  "away": {
   "shots": 8,
   "on_target": 5,
   "passes": 412,
   "passes_completed": 328,
   "pass_accuracy": 0.7961,
   "xg_model": 0.944,
   "xg_statsbomb": 0.839,
   "fouls": 15,
   "corners": 2,
   "yellow": 3,
   "red": 0
  }
 },
 "story": {
  "text": "France beat England 2-1 in the Quarter-finals of the FIFA World Cup 2022. England had more of the ball (60 percent to 40 percent), and England also created the better chances by expected goals, or xG, a measure of chance quality (2.51 to 0.94). The goals came from Aurélien Tchouaméni at 16:22, Harry Kane at 53:27 (penalty) and Olivier Giroud at 77:10.",
  "label": "Automated analysis"
 }
}
