{
 "match_id": 3869486,
 "competition": "FIFA World Cup",
 "season": "2022",
 "stage": "Quarter-finals",
 "date": "2022-12-10",
 "teams": {
  "home": {
   "id": 788,
   "name": "Morocco",
   "color": "#2E75B6"
  },
  "away": {
   "id": 780,
   "name": "Portugal",
   "color": "#B75410"
  }
 },
 "score": {
  "home": 1,
  "away": 0,
  "shootout": null,
  "note": null
 },
 "possession": {
  "method": "sum of possession-sequence duration (penalty shootout excluded)",
  "home": 0.2364,
  "away": 0.7636
 },
 "stats": {
  "home": {
   "shots": 9,
   "on_target": 3,
   "passes": 249,
   "passes_completed": 184,
   "pass_accuracy": 0.739,
   "xg_model": 1.275,
   "xg_statsbomb": 0.972,
   "fouls": 18,
   "corners": 3,
   "yellow": 3,
   "red": 1
  },
  "away": {
   "shots": 12,
   "on_target": 3,
   "passes": 731,
   "passes_completed": 616,
   "pass_accuracy": 0.8427,
   "xg_model": 0.975,
   "xg_statsbomb": 0.744,
   "fouls": 9,
   "corners": 9,
   "yellow": 1,
   "red": 0
  }
 },
 "story": {
  "text": "Morocco beat Portugal 1-0 in the Quarter-finals of the FIFA World Cup 2022. Portugal had more of the ball (76 percent to 24 percent), and Morocco created the better chances by expected goals, or xG, a measure of chance quality (1.27 to 0.97). The goals came from Youssef En-Nesyri at 41:36.",
  "speech": "Morocco beat Portugal in the Quarter-finals of the FIFA World Cup twenty twenty-two, one nil. Portugal had more of the ball, seventy-six percent, and Morocco created the better chances. The goals came from Youssef En-Nesyri in the forty-second minute.",
  "label": "Automated analysis"
 }
}
