{
 "match_id": 3857300,
 "competition": "FIFA World Cup",
 "season": "2022",
 "stage": "Group Stage",
 "date": "2022-11-22",
 "teams": {
  "home": {
   "id": 779,
   "name": "Argentina",
   "color": "#2E75B6"
  },
  "away": {
   "id": 799,
   "name": "Saudi Arabia",
   "color": "#B75410"
  }
 },
 "score": {
  "home": 1,
  "away": 2,
  "shootout": null,
  "note": null
 },
 "possession": {
  "method": "sum of possession-sequence duration (penalty shootout excluded)",
  "home": 0.7042,
  "away": 0.2958
 },
 "stats": {
  "home": {
   "shots": 15,
   "on_target": 6,
   "passes": 646,
   "passes_completed": 542,
   "pass_accuracy": 0.839,
   "xg_model": 2.284,
   "xg_statsbomb": 2.492,
   "fouls": 7,
   "corners": 9,
   "yellow": 0,
   "red": 0
  },
  "away": {
   "shots": 3,
   "on_target": 2,
   "passes": 286,
   "passes_completed": 197,
   "pass_accuracy": 0.6888,
   "xg_model": 0.2,
   "xg_statsbomb": 0.153,
   "fouls": 22,
   "corners": 2,
   "yellow": 6,
   "red": 0
  }
 },
 "story": {
  "text": "Saudi Arabia beat Argentina 2-1 in the Group Stage of the FIFA World Cup 2022. Argentina had more of the ball (70 percent to 30 percent), and Argentina also created the better chances by expected goals, or xG, a measure of chance quality (2.28 to 0.20). The goals came from Lionel Messi at 9:15 (penalty), Saleh Al Shehri at 47:40 and Salem Al Dawsari at 52:44.",
  "speech": "Saudi Arabia beat Argentina in the Group Stage of the FIFA World Cup twenty twenty-two, two one. Argentina had more of the ball, seventy percent, and Argentina also created the better chances. The goals came from Lionel Messi in the tenth minute, from the spot, Saleh Al Shehri in the forty-eighth minute, and Salem Al Dawsari in the fifty-third minute.",
  "label": "Automated analysis",
  "audio": "audio/3857300/story-77c7ce4c.ogg"
 }
}
