{
 "match_id": 3869685,
 "competition": "FIFA World Cup",
 "season": "2022",
 "stage": "Final",
 "date": "2022-12-18",
 "teams": {
  "home": {
   "id": 779,
   "name": "Argentina",
   "color": "#2E75B6"
  },
  "away": {
   "id": 771,
   "name": "France",
   "color": "#C55A11"
  }
 },
 "score": {
  "home": 3,
  "away": 3,
  "shootout": {
   "home": 4,
   "away": 2
  },
  "note": "Argentina won 4-2 on penalties after extra time."
 },
 "possession": {
  "method": "sum of possession-sequence duration (penalty shootout excluded)",
  "home": 0.5484,
  "away": 0.4516
 },
 "stats": {
  "home": {
   "shots": 20,
   "on_target": 10,
   "passes": 693,
   "passes_completed": 560,
   "pass_accuracy": 0.8081,
   "xg_model": 3.098,
   "xg_statsbomb": 2.758,
   "fouls": 29,
   "corners": 6,
   "yellow": 4,
   "red": 0
  },
  "away": {
   "shots": 10,
   "on_target": 5,
   "passes": 570,
   "passes_completed": 434,
   "pass_accuracy": 0.7614,
   "xg_model": 2.182,
   "xg_statsbomb": 2.273,
   "fouls": 19,
   "corners": 5,
   "yellow": 3,
   "red": 0
  }
 },
 "story": {
  "text": "Argentina and France drew 3-3 in the Final of the FIFA World Cup 2022. Argentina won 4-2 on penalties after extra time. Argentina had more of the ball (55 percent to 45 percent), and Argentina also created the better chances by expected goals, or xG, a measure of chance quality (3.10 to 2.18). The goals came from Lionel Messi at 22:24 (penalty), Ángel Di María at 35:22, Kylian Mbappé at 79:24 (penalty), Kylian Mbappé at 80:59, Lionel Messi at 107:58 and Kylian Mbappé at 117:05 (penalty).",
  "label": "Automated analysis"
 }
}
